{"message_id":"11111111-1111-4111-8111-111111111111","event_type":"inventario.validar","event_version":1,"correlation_id":"22222222-2222-4222-8222-222222222222","causation_id":null,"id_orden":"ORD-2026-000001","timestamp":"2026-07-19T22:30:00Z","source":"procesamiento-ordenes","attempt":0,"payload":{"cliente":{"cliente_id":"CLI-001","nombre_cliente":"María López","ruc_cliente":"20481234567"},"items":[{"codigo_articulo":"ART-001","cantidad":2}],"trace":[]}}
